<?xml version="1.0" encoding="UTF-8" ?>
<!--

    Copyright (c) 2006 Institut de recherches cliniques de Montreal (IRCM)

    This program is free software: you can redistribute it and/or modify
    it under the terms of the GNU Affero General Public License as published by
    the Free Software Foundation, either version 3 of the License, or
    (at your option) any later version.

    This program is distributed in the hope that it will be useful,
    but WITHOUT ANY WARRANTY; without even the implied warranty of
    MERCHANTABILITY or FITNESS FOR A PARTICULAR PURPOSE.  See the
    GNU General Public License for more details.

    You should have received a copy of the GNU Affero General Public License
    along with this program.  If not, see <http://www.gnu.org/licenses/>.

-->
<xs:schema xmlns:xs="http://www.w3.org/2001/XMLSchema">

<xs:annotation>
    <xs:documentation><![CDATA[
    Describes how MS analysis verification list should be written in XML to allow ProView to parse it.
    ]]></xs:documentation>
</xs:annotation>

<xs:element name="verifications">
    <xs:annotation>
        <xs:documentation><![CDATA[
        Verification list group.
        ]]></xs:documentation>
    </xs:annotation>
    <xs:complexType>
        <xs:sequence>
            <xs:element ref="verification" maxOccurs="unbounded" minOccurs="1"/>
        </xs:sequence>
    	<xs:attribute name="type" type="xs:ID" use="required"/>
    </xs:complexType>
</xs:element>
<xs:element name="verification">
    <xs:annotation>
        <xs:documentation><![CDATA[
        Verification to be done before launching MS analysis.
        ]]></xs:documentation>
    </xs:annotation>
    <xs:complexType>
        <xs:sequence>
            <xs:element ref="instrument" maxOccurs="unbounded" minOccurs="1"/>
        </xs:sequence>
    	<xs:attribute name="name" type="xs:ID" use="required"/>
    </xs:complexType>
</xs:element>
<xs:element name="instrument">
    <xs:annotation>
        <xs:documentation><![CDATA[
        Instrument on which verification applies.
        ]]></xs:documentation>
    </xs:annotation>
    <xs:complexType>
        <xs:sequence>
            <xs:element ref="source" maxOccurs="unbounded" minOccurs="0"/>
        </xs:sequence>
    	<xs:attribute name="name" type="xs:string" use="required"/>
    </xs:complexType>
</xs:element>
<xs:element name="source">
    <xs:annotation>
        <xs:documentation><![CDATA[
        Instrument's source on which verification applies.
        ]]></xs:documentation>
    </xs:annotation>
    <xs:complexType>
    	<xs:attribute name="name" type="xs:string" use="required"/>
    </xs:complexType>
</xs:element>


<!-- Main element -->
<xs:element name="msanalysis">
    <xs:annotation>
        <xs:documentation><![CDATA[
        MS analysis verification list.
        ]]></xs:documentation>
    </xs:annotation>
    <xs:complexType>
        <xs:sequence>
            <xs:element ref="verifications" maxOccurs="unbounded" minOccurs="0"/>
        </xs:sequence>
    </xs:complexType>
</xs:element>
</xs:schema>